{
  "confirmation_status": "finalized",
  "destination_account": "EUt7wV4f5bzSFJccZ5aafJV7zykZfyWz9rctaug7hVxd",
  "destination_account_after": "1000000",
  "destination_account_before": "0",
  "endpoint_identity_hash": "sha256:32540b5faa0f5d63398987e4e79ca7f4ef912bc4d0d4ffdc667a58b22be3c785",
  "network": "solana:devnet",
  "normalization_profile": "foundry-pay-domain-v1",
  "observed_amount_base_units": "1000000",
  "parser_id": "solana_json_rpc_reader_v1",
  "protocol_version": "1.0.0",
  "provider_id": "alchemy",
  "queried_at": "2026-07-23T21:13:53Z",
  "raw_response_hash": "sha256:b19b5281b29eba319d361185f22f38bd6292c6fd60f8618a88a54583a64839af",
  "signature": "RzgQYATtgFZNG7eDgktPAaKh3R922BEjYNLRnvM7u96eFjsnSe4aFYQAtgaP4Hi7kyn91itF1eTEeo498NJ8uS4",
  "slot": 478403722,
  "source_account": "ACMsvvFpaafhg3477mgTu3ovgrhFLn9VMTB6Nzp65mnf",
  "source_account_after": "99000000",
  "source_account_before": "100000000",
  "source_class": "L2",
  "source_id": "alchemy_devnet",
  "source_kind": "rpc",
  "transaction_error": "none",
  "trust_domain_id": "alchemy_infrastructure",
  "type": "source_observation"
}
