{
  "confirmation_status": "confirmed",
  "destination_account": "EUt7wV4f5bzSFJccZ5aafJV7zykZfyWz9rctaug7hVxd",
  "destination_account_after": "1000000",
  "destination_account_before": "0",
  "endpoint_identity_hash": "sha256:3d423a3cdf16d45a050ac04bd1af892df2aba3be585a23462392774390919658",
  "network": "solana:devnet",
  "normalization_profile": "foundry-pay-domain-v1",
  "observed_amount_base_units": "1000000",
  "parser_id": "fp_e2e_bundle_backfill_v1",
  "protocol_version": "1.0.0",
  "provider_id": "solana_public_rpc",
  "queried_at": "2026-07-23T20:46:22Z",
  "raw_response_hash": "sha256:676b72618e444f85756c05beeedfd30b73394da38a76e49c1e39e1454d055949",
  "signature": "RzgQYATtgFZNG7eDgktPAaKh3R922BEjYNLRnvM7u96eFjsnSe4aFYQAtgaP4Hi7kyn91itF1eTEeo498NJ8uS4",
  "slot": 478403722,
  "source_account": "ACMsvvFpaafhg3477mgTu3ovgrhFLn9VMTB6Nzp65mnf",
  "source_account_after": "99000000",
  "source_account_before": "100000000",
  "source_class": "L1",
  "source_id": "foundry_l1_canonical_devnet",
  "source_kind": "rpc",
  "transaction_error": "none",
  "trust_domain_id": "solana_public_infrastructure",
  "type": "source_observation"
}
